{
  "discovery": [],
  "assumptions": [],
  "plan": [],
  "changes": [],
  "tests": [],
  "validation": {
    "commands": [],
    "results": []
  },
  "limits": {
    "files_touched": 5,
    "workflow": "Main"
  },
  "risks": [],
  "rollback": [],
  "question": null,
  "status": "READY_FOR_REVIEW"
}
